<?xml version="1.0" encoding="UTF-8"?>
<test-data
    xmlns="http://pmd.sourceforge.net/rule-tests"
    xmlns:xsi="http://www.w3.org/2001/XMLSchema-instance"
    xsi:schemaLocation="http://pmd.sourceforge.net/rule-tests http://pmd.sourceforge.net/rule-tests_1_0_0.xsd">

    <test-code>
        <description>failure case</description>
        <expected-problems>1</expected-problems>
        <code><![CDATA[
public class Foo {
    public void bar() {
        {}
    }
}
        ]]></code>
    </test-code>

    <test-code>
        <description>statement block not empty</description>
        <expected-problems>0</expected-problems>
        <code><![CDATA[
public class Foo {
    public void bar() {
        { return; }
    }
}
        ]]></code>
    </test-code>

    <test-code>
        <description>not a statement block</description>
        <expected-problems>0</expected-problems>
        <code><![CDATA[
public class Foo {
    public void bar() {
        if (true) {
            return;
        }
    }
}
        ]]></code>
    </test-code>
    <test-code>
        <description>block in switch case</description>
        <expected-problems>1</expected-problems>
        <expected-linenumbers>4</expected-linenumbers>
        <code><![CDATA[
public class Foo {
    public void bar() {
        switch (1) {
        case 2: { }
        }
    }
}
        ]]></code>
    </test-code>
    <test-code>
        <description>block in switch case (arrow)</description>
        <expected-problems>1</expected-problems>
        <expected-linenumbers>4</expected-linenumbers>
        <code><![CDATA[
public class Foo {
    public void bar() {
        switch (1) {
        case 2 -> { }
        }
    }
}
        ]]></code>
    </test-code>
</test-data>
