<?xml version="1.0" encoding="UTF-8"?>
<test-data
    xmlns="http://pmd.sourceforge.net/rule-tests"
    xmlns:xsi="http://www.w3.org/2001/XMLSchema-instance"
    xsi:schemaLocation="http://pmd.sourceforge.net/rule-tests http://pmd.sourceforge.net/rule-tests_1_0_0.xsd">
    <test-code>
        <description><![CDATA[
ok
     ]]></description>
        <expected-problems>0</expected-problems>
        <code><![CDATA[
public class Foo {
 public int hashCode() {return 42;}
}
     ]]></code>
    </test-code>
    <test-code>
        <description><![CDATA[
hashcode
     ]]></description>
        <expected-problems>1</expected-problems>
        <code><![CDATA[
public class Foo {
 public int hashcode() {return 42;}
}
     ]]></code>
    </test-code>
    <test-code>
        <description><![CDATA[
HashCode
     ]]></description>
        <expected-problems>1</expected-problems>
        <code><![CDATA[
public class Foo {
 public int HashCode() {return 42;}
}
     ]]></code>
    </test-code>
    <test-code>
        <description><![CDATA[
Hashcode
     ]]></description>
        <expected-problems>1</expected-problems>
        <code><![CDATA[
public class Foo {
 public int Hashcode() {return 42;}
}
     ]]></code>
    </test-code>
</test-data>
