<?xml version="1.0" encoding="UTF-8"?>
<test-data
    xmlns="http://pmd.sourceforge.net/rule-tests"
    xmlns:xsi="http://www.w3.org/2001/XMLSchema-instance"
    xsi:schemaLocation="http://pmd.sourceforge.net/rule-tests http://pmd.sourceforge.net/rule-tests_1_0_0.xsd">

    <test-code>
        <description>failure case</description>
        <expected-problems>1</expected-problems>
        <expected-linenumbers>4</expected-linenumbers>
        <code><![CDATA[
public class Foo {
    void bar() {
        try {
        } catch (NullPointerException e) {
        }
    }
}
        ]]></code>
    </test-code>

    <test-code>
        <description>catching another type, ok</description>
        <expected-problems>0</expected-problems>
        <code><![CDATA[
public class Foo {
    void bar() {
        try {
        } catch (FooException e) {
        }
    }
    public static class FooException extends NullPointerException {}
}
        ]]></code>
    </test-code>

    <test-code>
        <description>throwing it, ok</description>
        <expected-problems>0</expected-problems>
        <code><![CDATA[
public class Foo {
    void bar() {
        throw new NullPointerException();
    }
}
        ]]></code>
    </test-code>
</test-data>
